-- Test aggregate edge cases
-- 1. Large aggregation result that should error
-- 2. Aggregation after deletion to test consistency
CREATE EXTENSION IF NOT EXISTS pg_search;
SET paradedb.enable_aggregate_custom_scan TO on;
SET paradedb.global_mutable_segment_rows = 0;
-- =====================================================================
-- SECTION 1: Large Aggregation Error
-- =====================================================================
-- Test that a window aggregation that returns a very large result errors gracefully.
-- We expect an error message about the result being too large.
CREATE TABLE large_agg_test (
    id SERIAL PRIMARY KEY,
    data TEXT
);
CREATE INDEX large_agg_test_idx ON large_agg_test
USING bm25 (id, data)
WITH (
    key_field = 'id',
    text_fields = '{"data": {"fast": true}}'
);
-- Insert enough data to make the terms aggregation result > 1MB
INSERT INTO large_agg_test (data) SELECT md5(g::text) FROM generate_series(1, 50000) g;
ANALYZE large_agg_test;
-- Test as window function
EXPLAIN (FORMAT TEXT, COSTS OFF, TIMING OFF, VERBOSE)
SELECT pdb.agg('{"terms": {"field": "data", "size": 50000}}'::jsonb) OVER ()
FROM large_agg_test
WHERE id @@@ paradedb.all()
ORDER BY id
LIMIT 1;
                                                                                                                             QUERY PLAN                                                                                                                             
--------------------------------------------------------------------------------------------------------------------------------------------------------------------------------------------------------------------------------------------------------------------
 Limit
   Output: (pdb.window_agg('{"entries":[{"Aggregate":{"Custom":{"agg_json":{"terms":{"size":50000,"field":"data"}},"filter":null,"indexrelid":0,"mvcc_visibility":"Enabled"}}}],"groupby":{"grouping_columns":[]},"uses_our_operator":false}'::text)), id
   ->  Gather Merge
         Output: (pdb.window_agg('{"entries":[{"Aggregate":{"Custom":{"agg_json":{"terms":{"size":50000,"field":"data"}},"filter":null,"indexrelid":0,"mvcc_visibility":"Enabled"}}}],"groupby":{"grouping_columns":[]},"uses_our_operator":false}'::text)), id
         Workers Planned: 1
         ->  Parallel Custom Scan (ParadeDB Base Scan) on public.large_agg_test
               Output: pdb.window_agg('{"entries":[{"Aggregate":{"Custom":{"agg_json":{"terms":{"size":50000,"field":"data"}},"filter":null,"indexrelid":0,"mvcc_visibility":"Enabled"}}}],"groupby":{"grouping_columns":[]},"uses_our_operator":false}'::text), id
               Table: large_agg_test
               Index: large_agg_test_idx
               Exec Method: TopKScanExecState
               Scores: false
                  TopK Order By: id asc
                  TopK Limit: 1
               Full Index Scan: true
               Tantivy Query: {"with_index":{"query":"all"}}
(15 rows)

SELECT pdb.agg('{"terms": {"field": "data", "size": 50000}}'::jsonb) OVER ()
FROM large_agg_test
WHERE id @@@ paradedb.all()
ORDER BY id
LIMIT 1;
ERROR:  Aggregate result is too large: 1800010 vs 1048576. Consider increasing the 'paradedb.max_window_aggregate_response_bytes' GUC.
DROP TABLE large_agg_test;
-- =====================================================================
-- SECTION 2: Aggregation After Deletion
-- =====================================================================
-- Test that aggregations are correct after rows are deleted.
CREATE TABLE delete_agg_test (
    id INT PRIMARY KEY,
    name TEXT
);
CREATE INDEX delete_agg_test_idx ON delete_agg_test
USING bm25 (id, name)
WITH (
    key_field = 'id',
    text_fields = '{"name": {}}'
);
INSERT INTO delete_agg_test VALUES (1, 'a'), (2, 'b'), (3, 'c'), (4, 'd'), (5, 'e');
ANALYZE delete_agg_test;
-- Delete all but one row
DELETE FROM delete_agg_test WHERE id > 1;
-- Test as aggregate function
-- Should return 1
EXPLAIN (FORMAT TEXT, COSTS OFF, TIMING OFF, VERBOSE)
SELECT COUNT(*) FROM delete_agg_test WHERE id @@@ paradedb.all();
                                   QUERY PLAN                                    
---------------------------------------------------------------------------------
 Custom Scan (ParadeDB Aggregate Scan) on public.delete_agg_test
   Output: pdb.agg_fn('COUNT(*)'::text)
   Index: delete_agg_test_idx
   Tantivy Query: {"with_index":{"query":"all"}}
     Applies to Aggregates: COUNT(*)
     Aggregate Definition: {"0":{"value_count":{"field":"ctid","missing":null}}}
(6 rows)

SELECT COUNT(*) FROM delete_agg_test WHERE id @@@ paradedb.all();
 count 
-------
     1
(1 row)

-- Should return {"value": 1.0}
EXPLAIN (FORMAT TEXT, COSTS OFF, TIMING OFF, VERBOSE)
SELECT pdb.agg('{"value_count": {"field": "id"}}'::jsonb) FROM delete_agg_test WHERE id @@@ paradedb.all();
                                  QUERY PLAN                                   
-------------------------------------------------------------------------------
 Custom Scan (ParadeDB Aggregate Scan) on public.delete_agg_test
   Output: pdb.agg_fn('pdb.agg'::text)
   Index: delete_agg_test_idx
   Tantivy Query: {"with_index":{"query":"all"}}
     Applies to Aggregates: CUSTOM_AGG({"value_count":{"field":"id"}})
     Aggregate Definition: {"0":{"value_count":{"field":"id","missing":null}}}
(6 rows)

SELECT pdb.agg('{"value_count": {"field": "id"}}'::jsonb) FROM delete_agg_test WHERE id @@@ paradedb.all();
      agg       
----------------
 {"value": 1.0}
(1 row)

-- Should return count: 1
EXPLAIN (FORMAT TEXT, COSTS OFF, TIMING OFF, VERBOSE)
SELECT pdb.agg('{"stats": {"field": "id"}}'::jsonb) FROM delete_agg_test WHERE id @@@ paradedb.all();
                               QUERY PLAN                                
-------------------------------------------------------------------------
 Custom Scan (ParadeDB Aggregate Scan) on public.delete_agg_test
   Output: pdb.agg_fn('pdb.agg'::text)
   Index: delete_agg_test_idx
   Tantivy Query: {"with_index":{"query":"all"}}
     Applies to Aggregates: CUSTOM_AGG({"stats":{"field":"id"}})
     Aggregate Definition: {"0":{"stats":{"field":"id","missing":null}}}
(6 rows)

SELECT pdb.agg('{"stats": {"field": "id"}}'::jsonb) FROM delete_agg_test WHERE id @@@ paradedb.all();
                             agg                              
--------------------------------------------------------------
 {"avg": 1.0, "max": 1.0, "min": 1.0, "sum": 1.0, "count": 1}
(1 row)

-- Test as window function
-- Should return 1 and {"value": 1.0}
EXPLAIN (FORMAT TEXT, COSTS OFF, TIMING OFF, VERBOSE)
SELECT
    COUNT(*) OVER (),
    pdb.agg('{"value_count": {"field": "id"}}'::jsonb) OVER ()
FROM delete_agg_test
WHERE id @@@ paradedb.all()
ORDER BY id
LIMIT 1;
                                                                                                                                                                                                    QUERY PLAN                                                                                                                                                                                                    
------------------------------------------------------------------------------------------------------------------------------------------------------------------------------------------------------------------------------------------------------------------------------------------------------------------------------------------------------------------------------------------------------------------
 Limit
   Output: (pdb.window_agg('{"entries":[{"Aggregate":{"CountAny":{"filter":null,"indexrelid":0}}}],"groupby":{"grouping_columns":[]},"uses_our_operator":false}'::text)), (pdb.window_agg('{"entries":[{"Aggregate":{"Custom":{"agg_json":{"value_count":{"field":"id"}},"filter":null,"indexrelid":0,"mvcc_visibility":"Enabled"}}}],"groupby":{"grouping_columns":[]},"uses_our_operator":false}'::text)), id
   ->  Custom Scan (ParadeDB Base Scan) on public.delete_agg_test
         Output: pdb.window_agg('{"entries":[{"Aggregate":{"CountAny":{"filter":null,"indexrelid":0}}}],"groupby":{"grouping_columns":[]},"uses_our_operator":false}'::text), pdb.window_agg('{"entries":[{"Aggregate":{"Custom":{"agg_json":{"value_count":{"field":"id"}},"filter":null,"indexrelid":0,"mvcc_visibility":"Enabled"}}}],"groupby":{"grouping_columns":[]},"uses_our_operator":false}'::text), id
         Table: delete_agg_test
         Index: delete_agg_test_idx
         Exec Method: TopKScanExecState
         Scores: false
            TopK Order By: id asc
            TopK Limit: 1
         Full Index Scan: true
         Tantivy Query: {"with_index":{"query":"all"}}
(12 rows)

SELECT
    COUNT(*) OVER (),
    pdb.agg('{"value_count": {"field": "id"}}'::jsonb) OVER ()
FROM delete_agg_test
WHERE id @@@ paradedb.all()
ORDER BY id
LIMIT 1;
 count |      agg       
-------+----------------
     1 | {"value": 1.0}
(1 row)

DROP TABLE delete_agg_test;
-- =====================================================================
-- SECTION 3: MVCC Visibility Settings
-- =====================================================================
CREATE TABLE mvcc_agg_test (
    id SERIAL PRIMARY KEY,
    category TEXT
);
CREATE INDEX mvcc_agg_test_idx ON mvcc_agg_test
USING bm25 (id, category)
WITH (
    key_field = 'id',
    text_fields = '{"category": {"fast": true}}'
);
INSERT INTO mvcc_agg_test (category) VALUES ('A'), ('B'), ('A');
ANALYZE mvcc_agg_test;
-- Test solve_mvcc=false in standard aggregate
EXPLAIN (FORMAT TEXT, COSTS OFF, TIMING OFF, VERBOSE)
SELECT pdb.agg('{"value_count": {"field": "category"}}'::jsonb, false) FROM mvcc_agg_test WHERE id @@@ paradedb.all();
                                     QUERY PLAN                                      
-------------------------------------------------------------------------------------
 Custom Scan (ParadeDB Aggregate Scan) on public.mvcc_agg_test
   Output: pdb.agg_fn('AGG'::text)
   Index: mvcc_agg_test_idx
   Tantivy Query: {"with_index":{"query":"all"}}
     Applies to Aggregates: CUSTOM_AGG({"value_count":{"field":"category"}})
     Aggregate Definition: {"0":{"value_count":{"field":"category","missing":null}}}
(6 rows)

SELECT pdb.agg('{"value_count": {"field": "category"}}'::jsonb, false) FROM mvcc_agg_test WHERE id @@@ paradedb.all();
      agg       
----------------
 {"value": 3.0}
(1 row)

-- Test solve_mvcc=false with GROUP BY
EXPLAIN (FORMAT TEXT, COSTS OFF, TIMING OFF, VERBOSE)
SELECT category, pdb.agg('{"value_count": {"field": "id"}}'::jsonb, false) FROM mvcc_agg_test WHERE id @@@ paradedb.all() GROUP BY category ORDER BY category;
                                                                                        QUERY PLAN                                                                                        
------------------------------------------------------------------------------------------------------------------------------------------------------------------------------------------
 Custom Scan (ParadeDB Aggregate Scan) on public.mvcc_agg_test
   Output: category, pdb.agg_fn('AGG'::text)
   Index: mvcc_agg_test_idx
   Tantivy Query: {"with_index":{"query":"all"}}
     Applies to Aggregates: CUSTOM_AGG({"value_count":{"field":"id"}})
     Group By: category
     Aggregate Definition: {"grouped":{"aggs":{"0":{"value_count":{"field":"id","missing":null}}},"terms":{"field":"category","order":{"_key":"asc"},"segment_size":65000,"size":65000}}}
(7 rows)

SELECT category, pdb.agg('{"value_count": {"field": "id"}}'::jsonb, false) FROM mvcc_agg_test WHERE id @@@ paradedb.all() GROUP BY category ORDER BY category;
 category |      agg       
----------+----------------
 A        | {"value": 2.0}
 B        | {"value": 1.0}
(2 rows)

-- Test conflicting MVCC settings (should error)
SELECT
    pdb.agg('{"value_count": {"field": "id"}}'::jsonb, false),
    pdb.agg('{"value_count": {"field": "category"}}'::jsonb, true)
FROM mvcc_agg_test WHERE id @@@ paradedb.all();
ERROR:  pdb.agg() calls have contradicting solve_mvcc settings. All pdb.agg() calls in a query must use the same solve_mvcc value. Either use solve_mvcc=true (or omit) for all, or solve_mvcc=false for all.
DROP TABLE mvcc_agg_test;
-- =====================================================================
-- SECTION 4: pdb.agg() with ||| operator (GitHub Issue #4456)
-- =====================================================================
-- Tests that pdb.agg() works with the ||| (text-contains) operator,
-- not just @@@. Previously, ||| caused AggregateScan to be rejected
-- because the operator was not recognized in the uses_our_operator check.
CREATE TABLE triple_pipe_agg_test (
    id SERIAL PRIMARY KEY,
    description TEXT,
    category TEXT
);
CREATE INDEX triple_pipe_agg_test_idx ON triple_pipe_agg_test
USING bm25 (id, description, category)
WITH (key_field = 'id', text_fields = '{"category": {"fast": true}}');
INSERT INTO triple_pipe_agg_test (description, category) VALUES
    ('running shoes for men', 'footwear'),
    ('running shoes for women', 'footwear'),
    ('casual walking shoes', 'footwear'),
    ('running shorts', 'apparel'),
    ('running jacket', 'apparel');
ANALYZE triple_pipe_agg_test;
-- Test 1: ||| operator with solve_mvcc=false — the exact failing query from issue #4456
EXPLAIN (FORMAT TEXT, COSTS OFF, TIMING OFF, VERBOSE)
SELECT pdb.agg('{"value_count": {"field": "id"}}'::jsonb, false)
FROM triple_pipe_agg_test
WHERE description ||| 'running shoes';
                                                                                                QUERY PLAN                                                                                                 
-----------------------------------------------------------------------------------------------------------------------------------------------------------------------------------------------------------
 Custom Scan (ParadeDB Aggregate Scan) on public.triple_pipe_agg_test
   Output: pdb.agg_fn('AGG'::text)
   Index: triple_pipe_agg_test_idx
   Tantivy Query: {"with_index":{"query":{"match":{"field":"description","value":"running shoes","tokenizer":null,"distance":null,"transposition_cost_one":null,"prefix":null,"conjunction_mode":false}}}}
     Applies to Aggregates: CUSTOM_AGG({"value_count":{"field":"id"}})
     Aggregate Definition: {"0":{"value_count":{"field":"id","missing":null}}}
(6 rows)

-- This SELECT is the actual proof the bug is fixed: it previously errored with
-- "pdb.agg() must be handled by ParadeDB's custom scan..."
SELECT pdb.agg('{"value_count": {"field": "id"}}'::jsonb, false)
FROM triple_pipe_agg_test
WHERE description ||| 'running shoes';
      agg       
----------------
 {"value": 5.0}
(1 row)

-- Test 2: ||| operator with solve_mvcc=true (explicit)
EXPLAIN (FORMAT TEXT, COSTS OFF, TIMING OFF, VERBOSE)
SELECT pdb.agg('{"value_count": {"field": "id"}}'::jsonb, true)
FROM triple_pipe_agg_test
WHERE description ||| 'running shoes';
                                                                                                QUERY PLAN                                                                                                 
-----------------------------------------------------------------------------------------------------------------------------------------------------------------------------------------------------------
 Custom Scan (ParadeDB Aggregate Scan) on public.triple_pipe_agg_test
   Output: pdb.agg_fn('AGG'::text)
   Index: triple_pipe_agg_test_idx
   Tantivy Query: {"with_index":{"query":{"match":{"field":"description","value":"running shoes","tokenizer":null,"distance":null,"transposition_cost_one":null,"prefix":null,"conjunction_mode":false}}}}
     Applies to Aggregates: CUSTOM_AGG({"value_count":{"field":"id"}})
     Aggregate Definition: {"0":{"value_count":{"field":"id","missing":null}}}
(6 rows)

SELECT pdb.agg('{"value_count": {"field": "id"}}'::jsonb, true)
FROM triple_pipe_agg_test
WHERE description ||| 'running shoes';
      agg       
----------------
 {"value": 5.0}
(1 row)

-- Test 3: ||| operator with solve_mvcc=false + GROUP BY
SELECT category, pdb.agg('{"value_count": {"field": "id"}}'::jsonb, false)
FROM triple_pipe_agg_test
WHERE description ||| 'running'
GROUP BY category
ORDER BY category;
 category |      agg       
----------+----------------
 apparel  | {"value": 2.0}
 footwear | {"value": 2.0}
(2 rows)

-- Test 4: ||| operator with deletion + solve_mvcc=false (verify count correctness)
DELETE FROM triple_pipe_agg_test WHERE id = 1;
SELECT pdb.agg('{"value_count": {"field": "id"}}'::jsonb, false)
FROM triple_pipe_agg_test
WHERE description ||| 'running shoes';
      agg       
----------------
 {"value": 5.0}
(1 row)

-- With solve_mvcc=true, should reflect the deletion
SELECT pdb.agg('{"value_count": {"field": "id"}}'::jsonb, true)
FROM triple_pipe_agg_test
WHERE description ||| 'running shoes';
      agg       
----------------
 {"value": 4.0}
(1 row)

-- Test 5: ||| with default (single-arg) pdb.agg — should also work
SELECT pdb.agg('{"value_count": {"field": "id"}}'::jsonb)
FROM triple_pipe_agg_test
WHERE description ||| 'running shoes';
      agg       
----------------
 {"value": 4.0}
(1 row)

-- Re-insert the deleted row so counts are predictable for remaining tests
INSERT INTO triple_pipe_agg_test (id, description, category) VALUES
    (1, 'running shoes for men', 'footwear');
-- Note: the earlier DELETE of id=1 left a ghost row in the Tantivy index.
-- The re-insert adds a new row, so with solve_mvcc=false the index now
-- contains 6 documents (5 original including the ghost + 1 re-inserted).
-- This is expected: solve_mvcc=false skips visibility checks.
-- Test 6: &&& operator with solve_mvcc=false (conjunction/AND match)
SELECT pdb.agg('{"value_count": {"field": "id"}}'::jsonb, false)
FROM triple_pipe_agg_test
WHERE description &&& 'running shoes';
      agg       
----------------
 {"value": 3.0}
(1 row)

-- Test 7: ### operator with solve_mvcc=false (phrase match)
SELECT pdb.agg('{"value_count": {"field": "id"}}'::jsonb, false)
FROM triple_pipe_agg_test
WHERE description ### 'running shoes';
      agg       
----------------
 {"value": 3.0}
(1 row)

-- Test 8: === operator with solve_mvcc=false (exact term match)
-- === matches individual tokens, so 'running' matches tokenized terms
SELECT pdb.agg('{"value_count": {"field": "id"}}'::jsonb, false)
FROM triple_pipe_agg_test
WHERE description === 'running';
      agg       
----------------
 {"value": 5.0}
(1 row)

-- Note: ## and ##> (proximity operators) require ProximityClause objects,
-- not plain text, so they cannot be tested with this simple pattern.
DROP TABLE triple_pipe_agg_test;
