-- =====================================================================
-- Aggregate-on-JOIN via DataFusion Backend
-- =====================================================================
-- Tests aggregate functions (COUNT, SUM, AVG, MIN, MAX) on JOIN queries
-- executed via the DataFusion custom scan backend.
CREATE EXTENSION IF NOT EXISTS pg_search;
SET paradedb.enable_aggregate_custom_scan TO on;
-- =====================================================================
-- Test Data Setup
-- =====================================================================
CREATE TABLE agg_join_products (
    id SERIAL PRIMARY KEY,
    description TEXT,
    category TEXT,
    price FLOAT,
    rating INTEGER
);
CREATE TABLE agg_join_tags (
    id SERIAL PRIMARY KEY,
    product_id INTEGER,
    tag_name TEXT
);
INSERT INTO agg_join_products (description, category, price, rating) VALUES
    ('Laptop with fast processor', 'Electronics', 999.99, 5),
    ('Gaming laptop with RGB', 'Electronics', 1299.99, 5),
    ('Running shoes for athletes', 'Sports', 89.99, 4),
    ('Winter jacket warm', 'Clothing', 129.99, 3),
    ('Toy laptop for kids', 'Toys', 499.99, 2);
INSERT INTO agg_join_tags (product_id, tag_name) VALUES
    (1, 'tech'), (1, 'computer'),
    (2, 'tech'), (2, 'gaming'),
    (3, 'fitness'), (3, 'running'),
    (4, 'outdoor'),
    (5, 'tech'), (5, 'kids');
CREATE INDEX agg_join_products_idx ON agg_join_products
USING bm25 (id, description, category, price, rating)
WITH (
    key_field='id',
    text_fields='{"description": {}, "category": {"fast": true}}',
    numeric_fields='{"price": {"fast": true}, "rating": {"fast": true}}'
);
CREATE INDEX agg_join_tags_idx ON agg_join_tags
USING bm25 (id, product_id, tag_name)
WITH (
    key_field='id',
    numeric_fields='{"product_id": {"fast": true}}',
    text_fields='{"tag_name": {"fast": true}}'
);
-- =====================================================================
-- SECTION 1: Scalar Aggregates on JOIN (no GROUP BY)
-- =====================================================================
-- Test 1.1: COUNT(*) — verifies basic join + aggregate works
EXPLAIN (FORMAT TEXT, COSTS OFF, TIMING OFF)
SELECT COUNT(*)
FROM agg_join_products p
JOIN agg_join_tags t ON p.id = t.product_id
WHERE p.description @@@ 'laptop';
                         QUERY PLAN                          
-------------------------------------------------------------
 Custom Scan (ParadeDB Aggregate Scan)
   Backend: DataFusion
   Indexes: agg_join_products_idx (p), agg_join_tags_idx (t)
   Aggregates: COUNT(*)(*)
(4 rows)

SELECT COUNT(*)
FROM agg_join_products p
JOIN agg_join_tags t ON p.id = t.product_id
WHERE p.description @@@ 'laptop';
 count 
-------
     6
(1 row)

-- Test 1.2: Multiple aggregates (COUNT, SUM, AVG)
EXPLAIN (FORMAT TEXT, COSTS OFF, TIMING OFF)
SELECT COUNT(*), SUM(p.price), AVG(p.rating)
FROM agg_join_products p
JOIN agg_join_tags t ON p.id = t.product_id
WHERE p.description @@@ 'laptop';
                         QUERY PLAN                          
-------------------------------------------------------------
 Custom Scan (ParadeDB Aggregate Scan)
   Backend: DataFusion
   Indexes: agg_join_products_idx (p), agg_join_tags_idx (t)
   Aggregates: COUNT(*)(*), SUM(price), AVG(rating)
(4 rows)

SELECT COUNT(*), SUM(p.price), AVG(p.rating)
FROM agg_join_products p
JOIN agg_join_tags t ON p.id = t.product_id
WHERE p.description @@@ 'laptop';
 count |        sum         | avg 
-------+--------------------+-----
     6 | 5599.9400000000005 |   4
(1 row)

-- Test 1.3: MIN/MAX
EXPLAIN (FORMAT TEXT, COSTS OFF, TIMING OFF)
SELECT MIN(p.price), MAX(p.price)
FROM agg_join_products p
JOIN agg_join_tags t ON p.id = t.product_id
WHERE p.description @@@ 'laptop';
                         QUERY PLAN                          
-------------------------------------------------------------
 Custom Scan (ParadeDB Aggregate Scan)
   Backend: DataFusion
   Indexes: agg_join_products_idx (p), agg_join_tags_idx (t)
   Aggregates: MIN(price), MAX(price)
(4 rows)

SELECT MIN(p.price), MAX(p.price)
FROM agg_join_products p
JOIN agg_join_tags t ON p.id = t.product_id
WHERE p.description @@@ 'laptop';
  min   |   max   
--------+---------
 499.99 | 1299.99
(1 row)

-- Test 1.4: All five aggregate functions together
SELECT COUNT(*), SUM(p.price), AVG(p.price), MIN(p.rating), MAX(p.rating)
FROM agg_join_products p
JOIN agg_join_tags t ON p.id = t.product_id
WHERE p.description @@@ 'laptop';
 count |        sum         |        avg        | min | max 
-------+--------------------+-------------------+-----+-----
     6 | 5599.9400000000005 | 933.3233333333334 |   2 |   5
(1 row)

-- =====================================================================
-- SECTION 2: Empty Result Sets
-- =====================================================================
-- Test 2.1: COUNT(*) on empty result — should return 0
SELECT COUNT(*)
FROM agg_join_products p
JOIN agg_join_tags t ON p.id = t.product_id
WHERE p.description @@@ 'nonexistent_term_xyz';
 count 
-------
     0
(1 row)

-- Test 2.2: SUM/AVG on empty result — should return NULL
SELECT SUM(p.price), AVG(p.rating)
FROM agg_join_products p
JOIN agg_join_tags t ON p.id = t.product_id
WHERE p.description @@@ 'nonexistent_term_xyz';
 sum | avg 
-----+-----
     |    
(1 row)

-- Test 2.3: MIN/MAX on empty result — should return NULL
SELECT MIN(p.price), MAX(p.price)
FROM agg_join_products p
JOIN agg_join_tags t ON p.id = t.product_id
WHERE p.description @@@ 'nonexistent_term_xyz';
 min | max 
-----+-----
     |    
(1 row)

-- =====================================================================
-- SECTION 3: Broader search predicates
-- =====================================================================
-- Test 3.1: Search matching all products (broader @@@ match)
SELECT COUNT(*)
FROM agg_join_products p
JOIN agg_join_tags t ON p.id = t.product_id
WHERE p.description @@@ 'laptop OR shoes OR jacket OR toy';
 count 
-------
     9
(1 row)

-- Test 3.2: COUNT of a specific column (not COUNT(*))
SELECT COUNT(p.rating)
FROM agg_join_products p
JOIN agg_join_tags t ON p.id = t.product_id
WHERE p.description @@@ 'laptop';
 count 
-------
     6
(1 row)

-- Test 3.3: Filter on non-search column (@@@ combined with scalar predicate)
SELECT COUNT(*), SUM(p.price)
FROM agg_join_products p
JOIN agg_join_tags t ON p.id = t.product_id
WHERE p.description @@@ 'laptop' AND p.price > 500;
 count |   sum   
-------+---------
     4 | 4599.96
(1 row)

-- =====================================================================
-- SECTION 4: GROUP BY on JOIN (requires custom_scan_tlist for scanrelid=0)
-- =====================================================================
-- Test 4.1: Single-column GROUP BY
EXPLAIN (FORMAT TEXT, COSTS OFF, TIMING OFF, VERBOSE)
SELECT p.category, COUNT(*)
FROM agg_join_products p
JOIN agg_join_tags t ON p.id = t.product_id
WHERE p.description @@@ 'laptop OR shoes'
GROUP BY p.category
ORDER BY p.category;
                            QUERY PLAN                             
-------------------------------------------------------------------
 Sort
   Output: p.category, (count(*))
   Sort Key: p.category
   ->  Custom Scan (ParadeDB Aggregate Scan)
         Output: p.category, (count(*))
         Backend: DataFusion
         Indexes: agg_join_products_idx (p), agg_join_tags_idx (t)
         Group By: category
         Aggregates: COUNT(*)(*)
(9 rows)

SELECT p.category, COUNT(*)
FROM agg_join_products p
JOIN agg_join_tags t ON p.id = t.product_id
WHERE p.description @@@ 'laptop OR shoes'
GROUP BY p.category
ORDER BY p.category;
  category   | count 
-------------+-------
 Electronics |     4
 Sports      |     2
 Toys        |     2
(3 rows)

-- Test 4.2: GROUP BY with multiple aggregates
SELECT p.category, COUNT(*), SUM(p.price), AVG(p.rating), MIN(p.price), MAX(p.price)
FROM agg_join_products p
JOIN agg_join_tags t ON p.id = t.product_id
WHERE p.description @@@ 'laptop OR shoes'
GROUP BY p.category
ORDER BY p.category;
  category   | count |   sum   | avg |  min   |   max   
-------------+-------+---------+-----+--------+---------
 Electronics |     4 | 4599.96 |   5 | 999.99 | 1299.99
 Sports      |     2 |  179.98 |   4 |  89.99 |   89.99
 Toys        |     2 |  999.98 |   2 | 499.99 |  499.99
(3 rows)

-- Test 4.3: Multi-column GROUP BY
SELECT p.category, t.tag_name, COUNT(*)
FROM agg_join_products p
JOIN agg_join_tags t ON p.id = t.product_id
WHERE p.description @@@ 'laptop OR shoes'
GROUP BY p.category, t.tag_name
ORDER BY p.category, t.tag_name;
  category   | tag_name | count 
-------------+----------+-------
 Electronics | computer |     1
 Electronics | gaming   |     1
 Electronics | tech     |     2
 Sports      | fitness  |     1
 Sports      | running  |     1
 Toys        | kids     |     1
 Toys        | tech     |     1
(7 rows)

-- Test 4.4: GROUP BY parity — DataFusion vs Postgres
SET paradedb.enable_aggregate_custom_scan TO off;
SELECT p.category, COUNT(*), SUM(p.price)
FROM agg_join_products p
JOIN agg_join_tags t ON p.id = t.product_id
WHERE p.description @@@ 'laptop OR shoes'
GROUP BY p.category
ORDER BY p.category;
  category   | count |   sum   
-------------+-------+---------
 Electronics |     4 | 4599.96
 Sports      |     2 |  179.98
 Toys        |     2 |  999.98
(3 rows)

SET paradedb.enable_aggregate_custom_scan TO on;
SELECT p.category, COUNT(*), SUM(p.price)
FROM agg_join_products p
JOIN agg_join_tags t ON p.id = t.product_id
WHERE p.description @@@ 'laptop OR shoes'
GROUP BY p.category
ORDER BY p.category;
  category   | count |   sum   
-------------+-------+---------
 Electronics |     4 | 4599.96
 Sports      |     2 |  179.98
 Toys        |     2 |  999.98
(3 rows)

-- =====================================================================
-- SECTION 5: NULL handling in aggregates
-- =====================================================================
-- Test 5.1: Aggregate on column with NULL values (products without tags)
-- Insert a product with no tags to test NULL join behavior
INSERT INTO agg_join_products (description, category, price, rating)
VALUES ('Orphan product no tags', 'Misc', NULL, NULL);
-- COUNT(*) should not include the orphan (INNER JOIN excludes it)
SELECT COUNT(*)
FROM agg_join_products p
JOIN agg_join_tags t ON p.id = t.product_id
WHERE p.description @@@ 'laptop OR orphan';
 count 
-------
     6
(1 row)

-- SUM/AVG on nullable columns — the orphan is excluded by INNER JOIN
SELECT SUM(p.price), AVG(p.rating)
FROM agg_join_products p
JOIN agg_join_tags t ON p.id = t.product_id
WHERE p.description @@@ 'laptop OR orphan';
        sum         | avg 
--------------------+-----
 5599.9400000000005 |   4
(1 row)

-- Clean up the orphan
DELETE FROM agg_join_products WHERE description = 'Orphan product no tags';
-- =====================================================================
-- SECTION 6: COUNT(DISTINCT) on JOIN
-- =====================================================================
-- Test 6.1: COUNT(DISTINCT) — routed through DataFusion via count_udaf(distinct=true).
EXPLAIN (FORMAT TEXT, COSTS OFF, TIMING OFF)
SELECT p.category, COUNT(DISTINCT t.tag_name)
FROM agg_join_products p
JOIN agg_join_tags t ON p.id = t.product_id
WHERE p.description @@@ 'laptop OR shoes'
GROUP BY p.category
ORDER BY p.category;
                            QUERY PLAN                             
-------------------------------------------------------------------
 Sort
   Sort Key: p.category
   ->  Custom Scan (ParadeDB Aggregate Scan)
         Backend: DataFusion
         Indexes: agg_join_products_idx (p), agg_join_tags_idx (t)
         Group By: category
         Aggregates: COUNT(DISTINCT)(tag_name)
(7 rows)

SELECT p.category, COUNT(DISTINCT t.tag_name)
FROM agg_join_products p
JOIN agg_join_tags t ON p.id = t.product_id
WHERE p.description @@@ 'laptop OR shoes'
GROUP BY p.category
ORDER BY p.category;
  category   | count 
-------------+-------
 Electronics |     3
 Sports      |     2
 Toys        |     2
(3 rows)

-- Test 6.2: COUNT(DISTINCT) parity — verify same result with custom scan off
SET paradedb.enable_aggregate_custom_scan TO off;
SELECT p.category, COUNT(DISTINCT t.tag_name)
FROM agg_join_products p
JOIN agg_join_tags t ON p.id = t.product_id
WHERE p.description @@@ 'laptop OR shoes'
GROUP BY p.category
ORDER BY p.category;
  category   | count 
-------------+-------
 Electronics |     3
 Sports      |     2
 Toys        |     2
(3 rows)

SET paradedb.enable_aggregate_custom_scan TO on;
-- Test 6.3: COUNT(DISTINCT) on the other join side (products table column)
EXPLAIN (FORMAT TEXT, COSTS OFF, TIMING OFF)
SELECT t.tag_name, COUNT(DISTINCT p.category)
FROM agg_join_products p
JOIN agg_join_tags t ON p.id = t.product_id
WHERE p.description @@@ 'laptop OR shoes'
GROUP BY t.tag_name
ORDER BY t.tag_name;
                            QUERY PLAN                             
-------------------------------------------------------------------
 Sort
   Sort Key: t.tag_name
   ->  Custom Scan (ParadeDB Aggregate Scan)
         Backend: DataFusion
         Indexes: agg_join_products_idx (p), agg_join_tags_idx (t)
         Group By: tag_name
         Aggregates: COUNT(DISTINCT)(category)
(7 rows)

SELECT t.tag_name, COUNT(DISTINCT p.category)
FROM agg_join_products p
JOIN agg_join_tags t ON p.id = t.product_id
WHERE p.description @@@ 'laptop OR shoes'
GROUP BY t.tag_name
ORDER BY t.tag_name;
 tag_name | count 
----------+-------
 computer |     1
 fitness  |     1
 gaming   |     1
 kids     |     1
 running  |     1
 tech     |     2
(6 rows)

-- Test 6.4: COUNT(DISTINCT) on other side — parity
SET paradedb.enable_aggregate_custom_scan TO off;
SELECT t.tag_name, COUNT(DISTINCT p.category)
FROM agg_join_products p
JOIN agg_join_tags t ON p.id = t.product_id
WHERE p.description @@@ 'laptop OR shoes'
GROUP BY t.tag_name
ORDER BY t.tag_name;
 tag_name | count 
----------+-------
 computer |     1
 fitness  |     1
 gaming   |     1
 kids     |     1
 running  |     1
 tech     |     2
(6 rows)

SET paradedb.enable_aggregate_custom_scan TO on;
-- =====================================================================
-- SECTION 7: LEFT JOIN aggregates
-- =====================================================================
-- Test 7.1: LEFT JOIN with COUNT — includes products with no tags
EXPLAIN (FORMAT TEXT, COSTS OFF, TIMING OFF)
SELECT p.category, COUNT(t.tag_name)
FROM agg_join_products p
LEFT JOIN agg_join_tags t ON p.id = t.product_id
WHERE p.description @@@ 'laptop OR shoes'
GROUP BY p.category;
                         QUERY PLAN                          
-------------------------------------------------------------
 Custom Scan (ParadeDB Aggregate Scan)
   Output: p.category, (count(t.tag_name))
   Backend: DataFusion
   Indexes: agg_join_products_idx (p), agg_join_tags_idx (t)
   Group By: category
   Aggregates: COUNT(tag_name)
(6 rows)

SELECT p.category, COUNT(t.tag_name)
FROM agg_join_products p
LEFT JOIN agg_join_tags t ON p.id = t.product_id
WHERE p.description @@@ 'laptop OR shoes'
GROUP BY p.category;
  category   | count 
-------------+-------
 Electronics |     4
 Sports      |     2
 Toys        |     2
(3 rows)

-- Test 7.2: LEFT JOIN parity — DataFusion vs Postgres native
SET paradedb.enable_aggregate_custom_scan TO off;
SELECT p.category, COUNT(t.tag_name), SUM(p.price)
FROM agg_join_products p
LEFT JOIN agg_join_tags t ON p.id = t.product_id
WHERE p.description @@@ 'laptop OR shoes'
GROUP BY p.category
ORDER BY p.category;
  category   | count |   sum   
-------------+-------+---------
 Electronics |     4 | 4599.96
 Sports      |     2 |  179.98
 Toys        |     2 |  999.98
(3 rows)

SET paradedb.enable_aggregate_custom_scan TO on;
SELECT p.category, COUNT(t.tag_name), SUM(p.price)
FROM agg_join_products p
LEFT JOIN agg_join_tags t ON p.id = t.product_id
WHERE p.description @@@ 'laptop OR shoes'
GROUP BY p.category
ORDER BY p.category;
  category   | count |   sum   
-------------+-------+---------
 Electronics |     4 | 4599.96
 Sports      |     2 |  179.98
 Toys        |     2 |  999.98
(3 rows)

-- Test 7.3: RIGHT JOIN with COUNT(left column) — includes tags without products
INSERT INTO agg_join_tags (product_id, tag_name) VALUES (999, 'orphan_tag');
EXPLAIN (FORMAT TEXT, COSTS OFF, TIMING OFF)
SELECT t.tag_name, COUNT(p.category)
FROM agg_join_products p
RIGHT JOIN agg_join_tags t ON p.id = t.product_id
WHERE t.tag_name @@@ 'tech OR orphan_tag'
GROUP BY t.tag_name
ORDER BY t.tag_name;
                            QUERY PLAN                             
-------------------------------------------------------------------
 Sort
   Sort Key: t.tag_name
   ->  Custom Scan (ParadeDB Aggregate Scan)
         Backend: DataFusion
         Indexes: agg_join_tags_idx (t), agg_join_products_idx (p)
         Group By: tag_name
         Aggregates: COUNT(category)
(7 rows)

SELECT t.tag_name, COUNT(p.category)
FROM agg_join_products p
RIGHT JOIN agg_join_tags t ON p.id = t.product_id
WHERE t.tag_name @@@ 'tech OR orphan_tag'
GROUP BY t.tag_name
ORDER BY t.tag_name;
  tag_name  | count 
------------+-------
 orphan_tag |     0
 tech       |     3
(2 rows)

-- Test 7.4: RIGHT JOIN parity — DataFusion vs Postgres native
SET paradedb.enable_aggregate_custom_scan TO off;
SELECT t.tag_name, COUNT(p.category)
FROM agg_join_products p
RIGHT JOIN agg_join_tags t ON p.id = t.product_id
WHERE t.tag_name @@@ 'tech OR orphan_tag'
GROUP BY t.tag_name
ORDER BY t.tag_name;
  tag_name  | count 
------------+-------
 orphan_tag |     0
 tech       |     3
(2 rows)

SET paradedb.enable_aggregate_custom_scan TO on;
SELECT t.tag_name, COUNT(p.category)
FROM agg_join_products p
RIGHT JOIN agg_join_tags t ON p.id = t.product_id
WHERE t.tag_name @@@ 'tech OR orphan_tag'
GROUP BY t.tag_name
ORDER BY t.tag_name;
  tag_name  | count 
------------+-------
 orphan_tag |     0
 tech       |     3
(2 rows)

DELETE FROM agg_join_tags
WHERE product_id = 999 AND tag_name = 'orphan_tag';
-- =====================================================================
-- SECTION 8: Composite ON clause (T_List equi-key extraction)
-- Postgres may wrap multi-condition ON clause quals in a T_List node
-- rather than a T_BoolExpr(AND). This tests that code path.
-- =====================================================================
CREATE TABLE comp_a (id SERIAL PRIMARY KEY, description TEXT, x INT, y INT);
CREATE TABLE comp_b (id SERIAL PRIMARY KEY, name TEXT, x INT, y INT);
INSERT INTO comp_a VALUES (1,'laptop fast',10,20),(2,'shoes nice',30,40),(3,'laptop pro',10,20);
INSERT INTO comp_b VALUES (1,'B1',10,20),(2,'B2',30,40);
CREATE INDEX idx_comp_a ON comp_a USING bm25(id,description,x,y) WITH (key_field='id',text_fields='{"description":{}}',numeric_fields='{"x":{"fast":true},"y":{"fast":true}}');
CREATE INDEX idx_comp_b ON comp_b USING bm25(id,name,x,y) WITH (key_field='id',text_fields='{"name":{}}',numeric_fields='{"x":{"fast":true},"y":{"fast":true}}');
-- Test 8.1: Composite ON with two equi-join keys — should use DataFusion
EXPLAIN (FORMAT TEXT, COSTS OFF, TIMING OFF)
SELECT COUNT(*)
FROM comp_a a
JOIN comp_b b ON a.x = b.x AND a.y = b.y
WHERE a.description @@@ 'laptop OR shoes';
                QUERY PLAN                 
-------------------------------------------
 Custom Scan (ParadeDB Aggregate Scan)
   Backend: DataFusion
   Indexes: idx_comp_a (a), idx_comp_b (b)
   Aggregates: COUNT(*)(*)
(4 rows)

SELECT COUNT(*)
FROM comp_a a
JOIN comp_b b ON a.x = b.x AND a.y = b.y
WHERE a.description @@@ 'laptop OR shoes';
 count 
-------
     3
(1 row)

-- Test 8.2: Parity check for composite ON
SET paradedb.enable_aggregate_custom_scan TO off;
SELECT COUNT(*)
FROM comp_a a
JOIN comp_b b ON a.x = b.x AND a.y = b.y
WHERE a.description @@@ 'laptop OR shoes';
 count 
-------
     3
(1 row)

SET paradedb.enable_aggregate_custom_scan TO on;
DROP TABLE comp_a;
DROP TABLE comp_b;
-- =====================================================================
-- SECTION 9: Verify single-table aggregates still use Tantivy
-- =====================================================================
-- Test 9.1: Single-table should show Tantivy backend (Index:, not Backend: DataFusion)
EXPLAIN (FORMAT TEXT, COSTS OFF, TIMING OFF)
SELECT COUNT(*) FROM agg_join_products WHERE description @@@ 'laptop';
                                                                      QUERY PLAN                                                                       
-------------------------------------------------------------------------------------------------------------------------------------------------------
 Custom Scan (ParadeDB Aggregate Scan) on agg_join_products
   Index: agg_join_products_idx
   Tantivy Query: {"with_index":{"query":{"parse_with_field":{"field":"description","query_string":"laptop","lenient":null,"conjunction_mode":null}}}}
     Applies to Aggregates: COUNT(*)
     Aggregate Definition: {"0":{"value_count":{"field":"ctid","missing":null}}}
(5 rows)

SELECT COUNT(*) FROM agg_join_products WHERE description @@@ 'laptop';
 count 
-------
     3
(1 row)

-- =====================================================================
-- SECTION 10: Correctness parity — compare DataFusion vs Postgres default
-- =====================================================================
-- Test 10.1: Run the same query with custom scan OFF to verify result parity
SET paradedb.enable_aggregate_custom_scan TO off;
SELECT COUNT(*)
FROM agg_join_products p
JOIN agg_join_tags t ON p.id = t.product_id
WHERE p.description @@@ 'laptop';
 count 
-------
     6
(1 row)

SELECT COUNT(*), SUM(p.price), AVG(p.rating), MIN(p.price), MAX(p.price)
FROM agg_join_products p
JOIN agg_join_tags t ON p.id = t.product_id
WHERE p.description @@@ 'laptop';
 count |   sum   |        avg         |  min   |   max   
-------+---------+--------------------+--------+---------
     6 | 5599.94 | 4.0000000000000000 | 499.99 | 1299.99
(1 row)

-- Restore
SET paradedb.enable_aggregate_custom_scan TO on;
-- =====================================================================
-- SECTION 10: STDDEV/VARIANCE aggregates on JOIN
-- =====================================================================
-- Test 10.1: STDDEV and VARIANCE on join
SELECT STDDEV(p.price), VARIANCE(p.price)
FROM agg_join_products p
JOIN agg_join_tags t ON p.id = t.product_id
WHERE p.description @@@ 'laptop OR shoes';
       stddev       |      variance      
--------------------+--------------------
 495.71737339507706 | 245735.71428571426
(1 row)

-- Test 10.2: STDDEV_POP and VAR_POP on join with GROUP BY
SELECT p.category, STDDEV_POP(p.rating), VAR_POP(p.rating)
FROM agg_join_products p
JOIN agg_join_tags t ON p.id = t.product_id
WHERE p.description @@@ 'laptop OR shoes'
GROUP BY p.category;
  category   | stddev_pop | var_pop 
-------------+------------+---------
 Electronics |          0 |       0
 Sports      |          0 |       0
 Toys        |          0 |       0
(3 rows)

-- Test 10.3: STDDEV parity — DataFusion vs Postgres native
SET paradedb.enable_aggregate_custom_scan TO off;
SELECT STDDEV(p.price)
FROM agg_join_products p
JOIN agg_join_tags t ON p.id = t.product_id
WHERE p.description @@@ 'laptop OR shoes';
      stddev       
-------------------
 495.7173733950771
(1 row)

SET paradedb.enable_aggregate_custom_scan TO on;
SELECT STDDEV(p.price)
FROM agg_join_products p
JOIN agg_join_tags t ON p.id = t.product_id
WHERE p.description @@@ 'laptop OR shoes';
       stddev       
--------------------
 495.71737339507706
(1 row)

-- =====================================================================
-- SECTION 11: Date/Timestamp aggregates on JOIN
-- =====================================================================
CREATE TABLE ts_orders (
    id SERIAL PRIMARY KEY,
    description TEXT,
    category TEXT,
    created_at TIMESTAMP
);
CREATE TABLE ts_items (
    id SERIAL PRIMARY KEY,
    order_id INTEGER,
    item_name TEXT
);
INSERT INTO ts_orders (description, category, created_at) VALUES
    ('Laptop order', 'Electronics', '2024-01-15 10:30:00'),
    ('Phone order', 'Electronics', '2024-03-20 14:45:00'),
    ('Shoes order', 'Sports', '2024-06-10 08:15:00');
INSERT INTO ts_items (order_id, item_name) VALUES
    (1, 'laptop'), (1, 'charger'),
    (2, 'phone'),
    (3, 'shoes'), (3, 'socks');
CREATE INDEX ts_orders_idx ON ts_orders
USING bm25 (id, description, category, created_at)
WITH (
    key_field='id',
    text_fields='{"description": {}, "category": {"fast": true}}',
    datetime_fields='{"created_at": {"fast": true}}'
);
CREATE INDEX ts_items_idx ON ts_items
USING bm25 (id, order_id, item_name)
WITH (
    key_field='id',
    numeric_fields='{"order_id": {"fast": true}}',
    text_fields='{"item_name": {"fast": true}}'
);
-- Test 10.1: MIN/MAX on timestamp column via join
SELECT MIN(o.created_at), MAX(o.created_at)
FROM ts_orders o
JOIN ts_items i ON o.id = i.order_id
WHERE o.description @@@ 'order';
           min            |           max
--------------------------+--------------------------
 Mon Jan 15 10:30:00 2024 | Mon Jun 10 08:15:00 2024
(1 row)

-- Test 10.2: GROUP BY with timestamp aggregate
SELECT o.category, MIN(o.created_at), MAX(o.created_at)
FROM ts_orders o
JOIN ts_items i ON o.id = i.order_id
WHERE o.description @@@ 'order'
GROUP BY o.category;
  category   |           min            |           max
-------------+--------------------------+--------------------------
 Electronics | Mon Jan 15 10:30:00 2024 | Wed Mar 20 14:45:00 2024
 Sports      | Mon Jun 10 08:15:00 2024 | Mon Jun 10 08:15:00 2024
(2 rows)

DROP TABLE ts_items;
DROP TABLE ts_orders;
-- =====================================================================
-- SECTION 11: ORDER BY aggregate NULLS FIRST / NULLS LAST
-- Tests that non-default NULL ordering in TopK produces correct results.
-- LEFT JOIN creates groups with NULL SUM (no right-side matches).
-- =====================================================================
-- Setup: product with no matching tags -> SUM(t.product_id) will be NULL for this group
INSERT INTO agg_join_products (id, description, price, category, rating)
VALUES (9901, 'nullsort test alpha', 10.00, 'NullSortA', 1.0);
INSERT INTO agg_join_products (id, description, price, category, rating)
VALUES (9902, 'nullsort test beta', 20.00, 'NullSortB', 2.0);
-- Give NullSortB some tags so its SUM is non-NULL
INSERT INTO agg_join_tags (product_id, tag_name) VALUES (9902, 'real_tag_1');
INSERT INTO agg_join_tags (product_id, tag_name) VALUES (9902, 'real_tag_2');
-- Rebuild the BM25 index so the new rows are visible
DROP INDEX agg_join_products_idx;
CREATE INDEX agg_join_products_idx ON agg_join_products
USING bm25 (id, description, category, price, rating)
WITH (
    key_field='id',
    text_fields='{"description": {}, "category": {"fast": true}}',
    numeric_fields='{"price": {"fast": true}, "rating": {"fast": true}}'
);
-- Test 11.1: DESC NULLS LAST — non-NULL rows should come first
SELECT p.category, SUM(t.product_id)
FROM agg_join_products p
LEFT JOIN agg_join_tags t ON p.id = t.product_id
WHERE p.description @@@ 'nullsort'
GROUP BY p.category
ORDER BY SUM(t.product_id) DESC NULLS LAST
LIMIT 2;
 category  |  sum
-----------+-------
 NullSortB | 19804
 NullSortA |
(2 rows)

-- Parity check
SET paradedb.enable_aggregate_custom_scan TO off;
SELECT p.category, SUM(t.product_id)
FROM agg_join_products p
LEFT JOIN agg_join_tags t ON p.id = t.product_id
WHERE p.description @@@ 'nullsort'
GROUP BY p.category
ORDER BY SUM(t.product_id) DESC NULLS LAST
LIMIT 2;
 category  |  sum
-----------+-------
 NullSortB | 19804
 NullSortA |
(2 rows)

SET paradedb.enable_aggregate_custom_scan TO on;
-- Test 11.2: ASC NULLS FIRST — NULL rows should come first
SELECT p.category, SUM(t.product_id)
FROM agg_join_products p
LEFT JOIN agg_join_tags t ON p.id = t.product_id
WHERE p.description @@@ 'nullsort'
GROUP BY p.category
ORDER BY SUM(t.product_id) ASC NULLS FIRST
LIMIT 2;
 category  |  sum
-----------+-------
 NullSortA |
 NullSortB | 19804
(2 rows)

-- Parity check
SET paradedb.enable_aggregate_custom_scan TO off;
SELECT p.category, SUM(t.product_id)
FROM agg_join_products p
LEFT JOIN agg_join_tags t ON p.id = t.product_id
WHERE p.description @@@ 'nullsort'
GROUP BY p.category
ORDER BY SUM(t.product_id) ASC NULLS FIRST
LIMIT 2;
 category  |  sum
-----------+-------
 NullSortA |
 NullSortB | 19804
(2 rows)

SET paradedb.enable_aggregate_custom_scan TO on;
-- Test 11.3: Default orderings (should still work — regression guard)
-- DESC NULLS FIRST (default for DESC)
SELECT p.category, SUM(t.product_id)
FROM agg_join_products p
LEFT JOIN agg_join_tags t ON p.id = t.product_id
WHERE p.description @@@ 'nullsort'
GROUP BY p.category
ORDER BY SUM(t.product_id) DESC
LIMIT 2;
 category  |  sum
-----------+-------
 NullSortA |
 NullSortB | 19804
(2 rows)

-- Parity check
SET paradedb.enable_aggregate_custom_scan TO off;
SELECT p.category, SUM(t.product_id)
FROM agg_join_products p
LEFT JOIN agg_join_tags t ON p.id = t.product_id
WHERE p.description @@@ 'nullsort'
GROUP BY p.category
ORDER BY SUM(t.product_id) DESC
LIMIT 2;
 category  |  sum
-----------+-------
 NullSortA |
 NullSortB | 19804
(2 rows)

SET paradedb.enable_aggregate_custom_scan TO on;
-- Cleanup
DELETE FROM agg_join_tags WHERE product_id IN (9901, 9902);
DELETE FROM agg_join_products WHERE id IN (9901, 9902);
-- =====================================================================
-- SECTION 12: Non-COUNT DISTINCT aggregates fall back to native PG
-- Verifies SUM(DISTINCT), AVG(DISTINCT) do NOT route through DataFusion.
-- =====================================================================
-- SUM(DISTINCT) should NOT show AggregateScan
EXPLAIN (COSTS OFF)
SELECT p.category, SUM(DISTINCT t.product_id)
FROM agg_join_products p
JOIN agg_join_tags t ON p.id = t.product_id
WHERE p.description @@@ 'laptop OR shoes'
GROUP BY p.category;
WARNING:  Aggregate Scan (DataFusion) not used: unsupported aggregate function OID: 2108 (table: join)
                                                                                       QUERY PLAN
----------------------------------------------------------------------------------------------------------------------------------------------------------------------------------------
 GroupAggregate
   Group Key: p.category
   ->  Sort
         Sort Key: p.category, t.product_id
         ->  Hash Join
               Hash Cond: (t.product_id = p.id)
               ->  Seq Scan on agg_join_tags t
               ->  Hash
                     ->  Custom Scan (ParadeDB Base Scan) on agg_join_products p
                           Table: agg_join_products
                           Index: agg_join_products_idx
                           Exec Method: ColumnarExecState
                           Fast Fields: category, id
                           Scores: false
                           Tantivy Query: {"with_index":{"query":{"parse_with_field":{"field":"description","query_string":"laptop OR shoes","lenient":null,"conjunction_mode":null}}}}
(15 rows)

-- AVG(DISTINCT) should NOT show AggregateScan
EXPLAIN (COSTS OFF)
SELECT p.category, AVG(DISTINCT t.product_id)
FROM agg_join_products p
JOIN agg_join_tags t ON p.id = t.product_id
WHERE p.description @@@ 'laptop OR shoes'
GROUP BY p.category;
WARNING:  Aggregate Scan (DataFusion) not used: unsupported aggregate function OID: 2101 (table: join)
                                                                                       QUERY PLAN
----------------------------------------------------------------------------------------------------------------------------------------------------------------------------------------
 GroupAggregate
   Group Key: p.category
   ->  Sort
         Sort Key: p.category, t.product_id
         ->  Hash Join
               Hash Cond: (t.product_id = p.id)
               ->  Seq Scan on agg_join_tags t
               ->  Hash
                     ->  Custom Scan (ParadeDB Base Scan) on agg_join_products p
                           Table: agg_join_products
                           Index: agg_join_products_idx
                           Exec Method: ColumnarExecState
                           Fast Fields: category, id
                           Scores: false
                           Tantivy Query: {"with_index":{"query":{"parse_with_field":{"field":"description","query_string":"laptop OR shoes","lenient":null,"conjunction_mode":null}}}}
(15 rows)

-- COUNT(DISTINCT) should still show AggregateScan (this still works)
EXPLAIN (COSTS OFF)
SELECT p.category, COUNT(DISTINCT t.tag_name)
FROM agg_join_products p
JOIN agg_join_tags t ON p.id = t.product_id
WHERE p.description @@@ 'laptop OR shoes'
GROUP BY p.category;
                         QUERY PLAN
-------------------------------------------------------------
 Custom Scan (ParadeDB Aggregate Scan)
   Backend: DataFusion
   Indexes: agg_join_products_idx (p), agg_join_tags_idx (t)
   Group By: category
   Aggregates: COUNT(DISTINCT)(tag_name)
(5 rows)

-- =====================================================================
-- SECTION 13: Cross-table OR predicates (regression for generated_joins_small)
-- =====================================================================
-- Reproduces a proptest failure where COUNT(*) with an OR predicate spanning
-- two join tables returned a different result under the aggregate scan path.
-- The aggregate scan must not mishandle cross-table OR conditions.
-- Test 13.1: Cross-table OR — aggregate scan vs native Postgres
SELECT COUNT(*)
FROM agg_join_products p
JOIN agg_join_tags t ON p.id = t.product_id
WHERE (t.id = 1 OR p.id = 1) AND p.description @@@ 'laptop';
WARNING:  Aggregate Scan (DataFusion) not used: join has non-equi quals that cannot be pushed to individual table scans (table: join)
 count
-------
     2
(1 row)

SET paradedb.enable_aggregate_custom_scan TO off;
SELECT COUNT(*)
FROM agg_join_products p
JOIN agg_join_tags t ON p.id = t.product_id
WHERE (t.id = 1 OR p.id = 1) AND p.description @@@ 'laptop';
 count
-------
     2
(1 row)

SET paradedb.enable_aggregate_custom_scan TO on;
-- Test 13.2: Cross-table OR with @@@ on both sides
SELECT COUNT(*)
FROM agg_join_products p
JOIN agg_join_tags t ON p.id = t.product_id
WHERE (t.id @@@ '1' OR p.id @@@ '1') AND p.description @@@ 'laptop';
 count
-------
     2
(1 row)

SET paradedb.enable_aggregate_custom_scan TO off;
SELECT COUNT(*)
FROM agg_join_products p
JOIN agg_join_tags t ON p.id = t.product_id
WHERE (t.id @@@ '1' OR p.id @@@ '1') AND p.description @@@ 'laptop';
 count
-------
     2
(1 row)

SET paradedb.enable_aggregate_custom_scan TO on;
-- =====================================================================
-- Clean up
-- =====================================================================
DROP TABLE agg_join_tags;
DROP TABLE agg_join_products;
