-- Tests that cardinality aggregations remain MVCC-correct in the presence of
-- deleted (unvacuumed) rows, and that solve_mvcc=false overshoots by counting
-- values that only exist on dead rows.
\echo 'Test: cardinality MVCC correctness with deletes'
Test: cardinality MVCC correctness with deletes
CREATE EXTENSION IF NOT EXISTS pg_search;
SET paradedb.check_aggregate_scan = false;
DROP TABLE IF EXISTS card_mvcc;
CREATE TABLE card_mvcc (
    id serial8,
    val uuid NOT NULL
) WITH (autovacuum_enabled = off);
-- 10k rows over 12 distinct deterministic uuids
INSERT INTO card_mvcc (val)
SELECT md5('cardtest' || ((x % 12) + 1))::uuid
FROM generate_series(1, 10000) x;
CREATE INDEX idx_card_mvcc ON card_mvcc
USING bm25 (id, val) WITH (key_field = 'id');
-- before any deletes: 12 either way
SELECT pdb.agg('{"cardinality": {"field": "val"}}'::jsonb) FROM card_mvcc WHERE card_mvcc @@@ pdb.all();
       agg       
-----------------
 {"value": 12.0}
(1 row)

SELECT pdb.agg('{"cardinality": {"field": "val"}}'::jsonb, false) FROM card_mvcc WHERE card_mvcc @@@ pdb.all();
       agg       
-----------------
 {"value": 12.0}
(1 row)

-- delete every row of one value, plus scattered rows of the others; no vacuum,
-- so the index still contains all 12 values
DELETE FROM card_mvcc WHERE val = md5('cardtest' || 12)::uuid;
DELETE FROM card_mvcc WHERE id % 10 = 0;
SELECT count(DISTINCT val) AS true_cardinality FROM card_mvcc;
 true_cardinality 
------------------
               11
(1 row)

-- MVCC-correct: the fully-deleted value is not counted. A value whose first
-- occurrences are dead but which still has live rows must be counted.
SELECT pdb.agg('{"cardinality": {"field": "val"}}'::jsonb) FROM card_mvcc WHERE card_mvcc @@@ pdb.all();
       agg       
-----------------
 {"value": 11.0}
(1 row)

-- solve_mvcc=false counts raw index entries: overshoots to 12
SELECT pdb.agg('{"cardinality": {"field": "val"}}'::jsonb, false) FROM card_mvcc WHERE card_mvcc @@@ pdb.all();
       agg       
-----------------
 {"value": 12.0}
(1 row)

-- delete everything: MVCC-correct cardinality drops to 0
DELETE FROM card_mvcc;
SELECT pdb.agg('{"cardinality": {"field": "val"}}'::jsonb) FROM card_mvcc WHERE card_mvcc @@@ pdb.all();
      agg       
----------------
 {"value": 0.0}
(1 row)

SELECT pdb.agg('{"cardinality": {"field": "val"}}'::jsonb, false) FROM card_mvcc WHERE card_mvcc @@@ pdb.all();
       agg       
-----------------
 {"value": 12.0}
(1 row)

DROP TABLE card_mvcc;
