-- Tests that cardinality aggregations remain MVCC-correct in the presence of
-- deleted (unvacuumed) rows, and that solve_mvcc=false overshoots by counting
-- values that only exist on dead rows.
\echo 'Test: cardinality MVCC correctness with deletes'
Test: cardinality MVCC correctness with deletes
CREATE EXTENSION IF NOT EXISTS pg_search;
DROP TABLE IF EXISTS card_mvcc;
CREATE TABLE card_mvcc (
    id serial8,
    val uuid NOT NULL,
    num int NOT NULL
) WITH (autovacuum_enabled = off);
-- 10k rows over 12 distinct deterministic uuids; num mirrors the uuid group
INSERT INTO card_mvcc (val, num)
SELECT md5('cardtest' || ((x % 12) + 1))::uuid, (x % 12) + 1
FROM generate_series(1, 10000) x;
CREATE INDEX idx_card_mvcc ON card_mvcc
USING bm25 (id, val, num)
WITH (key_field = 'id', numeric_fields = '{"num": {"fast": true}}');
-- the aggregate form runs on the aggregate custom scan
EXPLAIN (COSTS OFF, VERBOSE, TIMING OFF)
SELECT pdb.agg('{"cardinality": {"field": "val"}}'::jsonb) FROM card_mvcc WHERE card_mvcc @@@ pdb.all();
                               QUERY PLAN                               
------------------------------------------------------------------------
 Custom Scan (ParadeDB Aggregate Scan) on public.card_mvcc
   Output: pdb.agg_fn('pdb.agg'::text)
   Index: idx_card_mvcc
   Tantivy Query: {"with_index":{"query":{"all":{"field":"id"}}}}
     Applies to Aggregates: CUSTOM_AGG({"cardinality":{"field":"val"}})
     Aggregate Definition: {"0":{"cardinality":{"field":"val"}}}
(6 rows)

-- before any deletes: 12 either way
SELECT pdb.agg('{"cardinality": {"field": "val"}}'::jsonb) FROM card_mvcc WHERE card_mvcc @@@ pdb.all();
       agg       
-----------------
 {"value": 12.0}
(1 row)

SELECT pdb.agg('{"cardinality": {"field": "val"}}'::jsonb, false) FROM card_mvcc WHERE card_mvcc @@@ pdb.all();
       agg       
-----------------
 {"value": 12.0}
(1 row)

-- delete every row of one value, plus scattered rows of the others; no vacuum,
-- so the index still contains all 12 values
DELETE FROM card_mvcc WHERE val = md5('cardtest' || 12)::uuid;
DELETE FROM card_mvcc WHERE id % 10 = 0;
SET paradedb.check_aggregate_scan = false; -- DISTINCT can't use the aggregate scan
SELECT count(DISTINCT val) AS true_cardinality FROM card_mvcc;
 true_cardinality 
------------------
               11
(1 row)

RESET paradedb.check_aggregate_scan;
-- MVCC-correct: the fully-deleted value is not counted. A value whose first
-- occurrences are dead but which still has live rows must be counted.
SELECT pdb.agg('{"cardinality": {"field": "val"}}'::jsonb) FROM card_mvcc WHERE card_mvcc @@@ pdb.all();
       agg       
-----------------
 {"value": 11.0}
(1 row)

-- solve_mvcc=false counts raw index entries: overshoots to 12
SELECT pdb.agg('{"cardinality": {"field": "val"}}'::jsonb, false) FROM card_mvcc WHERE card_mvcc @@@ pdb.all();
       agg       
-----------------
 {"value": 12.0}
(1 row)

-- requests ineligible for the in-aggregation cardinality fast path solve MVCC
-- by filtering matched docs instead, and must be equally correct:
-- cardinality alongside a non-cardinality aggregate
SELECT pdb.agg('{"cardinality": {"field": "val"}}'::jsonb) AS card,
       pdb.agg('{"min": {"field": "num"}}'::jsonb) AS min_num
FROM card_mvcc WHERE card_mvcc @@@ pdb.all();
      card       |    min_num     
-----------------+----------------
 {"value": 11.0} | {"value": 1.0}
(1 row)

-- cardinality over a numeric field
SELECT pdb.agg('{"cardinality": {"field": "num"}}'::jsonb) FROM card_mvcc WHERE card_mvcc @@@ pdb.all();
       agg       
-----------------
 {"value": 11.0}
(1 row)

-- cardinality as a sub-aggregation; every num group holds exactly one val
SELECT pdb.agg('{"terms": {"field": "num", "size": 3}, "aggs": {"vals": {"cardinality": {"field": "val"}}}}'::jsonb)
FROM card_mvcc WHERE card_mvcc @@@ pdb.all();
                                                                                                                      agg                                                                                                                       
------------------------------------------------------------------------------------------------------------------------------------------------------------------------------------------------------------------------------------------------
 {"buckets": [{"key": 4, "vals": {"value": 1.0}, "doc_count": 834}, {"key": 2, "vals": {"value": 1.0}, "doc_count": 834}, {"key": 8, "vals": {"value": 1.0}, "doc_count": 833}], "sum_other_doc_count": 5666, "doc_count_error_upper_bound": 0}
(1 row)

-- facet form: cardinality as a window aggregate alongside top-k. Same MVCC
-- semantics: correct with solve_mvcc, overshoots without.
EXPLAIN (COSTS OFF, VERBOSE, TIMING OFF)
SELECT id, pdb.agg('{"cardinality": {"field": "val"}}'::jsonb, true) OVER () AS agg
FROM card_mvcc WHERE card_mvcc @@@ pdb.all()
ORDER BY id DESC LIMIT 1 OFFSET 0;
                                                                                                                      QUERY PLAN                                                                                                                      
------------------------------------------------------------------------------------------------------------------------------------------------------------------------------------------------------------------------------------------------------
 Limit
   Output: id, (pdb.window_agg('{"entries":[{"Aggregate":{"Custom":{"agg_json":{"cardinality":{"field":"val"}},"filter":null,"indexrelid":0,"mvcc_visibility":"Enabled"}}}],"groupby":{"grouping_columns":[]},"uses_our_operator":false}'::text))
   ->  Custom Scan (ParadeDB Base Scan) on public.card_mvcc
         Output: id, pdb.window_agg('{"entries":[{"Aggregate":{"Custom":{"agg_json":{"cardinality":{"field":"val"}},"filter":null,"indexrelid":0,"mvcc_visibility":"Enabled"}}}],"groupby":{"grouping_columns":[]},"uses_our_operator":false}'::text)
         Table: card_mvcc
         Index: idx_card_mvcc
         Worker Selection: Row-capped
         Exec Method: TopKScanExecState
         Scores: false
            TopK Order By: id desc
            TopK Limit: 1
         Tantivy Query: {"with_index":{"query":{"all":{"field":"id"}}}}
(12 rows)

SELECT id, pdb.agg('{"cardinality": {"field": "val"}}'::jsonb, true) OVER () AS agg
FROM card_mvcc WHERE card_mvcc @@@ pdb.all()
ORDER BY id DESC LIMIT 1 OFFSET 0;
  id  |       agg       
------+-----------------
 9999 | {"value": 11.0}
(1 row)

SELECT id, pdb.agg('{"cardinality": {"field": "val"}}'::jsonb, false) OVER () AS agg
FROM card_mvcc WHERE card_mvcc @@@ pdb.all()
ORDER BY id DESC LIMIT 1 OFFSET 0;
  id  |       agg       
------+-----------------
 9999 | {"value": 12.0}
(1 row)

-- delete everything: MVCC-correct cardinality drops to 0
DELETE FROM card_mvcc;
SELECT pdb.agg('{"cardinality": {"field": "val"}}'::jsonb) FROM card_mvcc WHERE card_mvcc @@@ pdb.all();
      agg       
----------------
 {"value": 0.0}
(1 row)

SELECT pdb.agg('{"cardinality": {"field": "val"}}'::jsonb, false) FROM card_mvcc WHERE card_mvcc @@@ pdb.all();
       agg       
-----------------
 {"value": 12.0}
(1 row)

DROP TABLE card_mvcc;
-- A value that is dead in one segment but live in another must count exactly
-- once: the fast path confirms visible values per segment.
DROP TABLE IF EXISTS card_mvcc_seg;
CREATE TABLE card_mvcc_seg (
    id serial8,
    val text NOT NULL,
    batch int NOT NULL
) WITH (autovacuum_enabled = off);
-- mutable_segment_rows and the zeroed layer sizes force each insert into its
-- own immutable segment, with no merging
CREATE INDEX idx_card_mvcc_seg ON card_mvcc_seg
USING bm25 (id, val, batch)
WITH (
    key_field = 'id',
    text_fields = '{"val": {"fast": true}}',
    numeric_fields = '{"batch": {"fast": true}}',
    mutable_segment_rows = 2,
    layer_sizes = '0',
    background_layer_sizes = '0'
);
-- two inserts -> separate segments over the same five values
INSERT INTO card_mvcc_seg (val, batch) SELECT 'v' || (x % 5), 1 FROM generate_series(1, 1000) x;
INSERT INTO card_mvcc_seg (val, batch) SELECT 'v' || (x % 5), 2 FROM generate_series(1, 1000) x;
SELECT count(*) >= 2 AS multiple_segments FROM paradedb.index_info('idx_card_mvcc_seg');
 multiple_segments 
-------------------
 t
(1 row)

-- v0: dead in the first batch's segment, live in the second's. v1: dead everywhere.
DELETE FROM card_mvcc_seg WHERE batch = 1 AND val = 'v0';
DELETE FROM card_mvcc_seg WHERE val = 'v1';
SET paradedb.check_aggregate_scan = false; -- DISTINCT can't use the aggregate scan
SELECT count(DISTINCT val) AS true_cardinality FROM card_mvcc_seg;
 true_cardinality 
------------------
                4
(1 row)

RESET paradedb.check_aggregate_scan;
SELECT pdb.agg('{"cardinality": {"field": "val"}}'::jsonb) FROM card_mvcc_seg WHERE card_mvcc_seg @@@ pdb.all();
      agg       
----------------
 {"value": 4.0}
(1 row)

SELECT pdb.agg('{"cardinality": {"field": "val"}}'::jsonb, false) FROM card_mvcc_seg WHERE card_mvcc_seg @@@ pdb.all();
      agg       
----------------
 {"value": 5.0}
(1 row)

DROP TABLE card_mvcc_seg;
