SET client_min_messages = error;
SET max_parallel_workers_per_gather = 0;
SET paradedb.enable_custom_scan = off;
SET enable_indexscan = off;
SET enable_indexonlyscan = off;
SET enable_bitmapscan = off;
CREATE TABLE returning_current (id int PRIMARY KEY, body text NOT NULL, note text)
WITH (fillfactor = 50);
INSERT INTO returning_current VALUES (1, 'alpha', 'before');
CREATE INDEX returning_current_idx ON returning_current USING paradedb (id, body);
BEGIN;
UPDATE returning_current SET note = 'after' WHERE id = 1
RETURNING id, body = 'alpha' AS native, body === 'alpha' AS paradedb;
 id | native | paradedb 
----+--------+----------
  1 | t      | t
(1 row)

ROLLBACK;
BEGIN;
INSERT INTO returning_current VALUES (2, 'alpha', 'new')
RETURNING id, body = 'alpha' AS native, body === 'alpha' AS paradedb;
 id | native | paradedb 
----+--------+----------
  2 | t      | t
(1 row)

ROLLBACK;
BEGIN;
SAVEPOINT returning_subxid;
UPDATE returning_current SET body = 'beta' WHERE id = 1
RETURNING id, body = 'alpha' AS native, body === 'alpha' AS paradedb;
 id | native | paradedb 
----+--------+----------
  1 | f      | f
(1 row)

INSERT INTO returning_current VALUES (2, 'alpha', 'new'), (3, 'beta', 'new')
RETURNING id, body = 'alpha' AS native, body === 'alpha' AS paradedb;
 id | native | paradedb 
----+--------+----------
  2 | t      | t
  3 | f      | f
(2 rows)

RELEASE SAVEPOINT returning_subxid;
UPDATE returning_current SET body = 'alpha'
WHERE id = 1 AND body === 'beta'
RETURNING id, body = 'alpha' AS native, body === 'alpha' AS paradedb;
 id | native | paradedb 
----+--------+----------
  1 | t      | t
(1 row)

SELECT id, body = 'alpha' AS native, body === 'alpha' AS paradedb
FROM returning_current ORDER BY id;
 id | native | paradedb 
----+--------+----------
  1 | t      | t
  2 | t      | t
  3 | f      | f
(3 rows)

DELETE FROM returning_current WHERE id = 2 AND body === 'alpha'
RETURNING id, body = 'alpha' AS native, body === 'alpha' AS paradedb;
 id | native | paradedb 
----+--------+----------
  2 | t      | t
(1 row)

ROLLBACK;
DROP TABLE returning_current;
CREATE TABLE earlier_command (id int, body text, note text) WITH (fillfactor = 50);
CREATE INDEX earlier_command_idx ON earlier_command USING paradedb (id, (body::pdb.literal));
BEGIN;
INSERT INTO earlier_command VALUES (1, 'alpha', 'before'), (2, 'beta', 'before'), (3, NULL, 'before');
SELECT bool_and(paradedb.xmin_is_visible(xmin, tableoid, ctid)) AS visible,
       bool_and((body === 'alpha') IS NOT DISTINCT FROM (body = 'alpha')) AS matches
FROM earlier_command;
 visible | matches 
---------+---------
 t       | t
(1 row)

-- Current-command replacements need inline evaluation; the next statement can use CTIDs.
SAVEPOINT earlier_command_update;
WITH changed AS (
    UPDATE earlier_command SET note = 'after'
    RETURNING paradedb.xmin_is_visible(xmin, tableoid, ctid) AS visible,
              (body === 'alpha') IS NOT DISTINCT FROM (body = 'alpha') AS matches
)
SELECT bool_and(NOT visible) AS outside_snapshot, bool_and(matches) AS matches FROM changed;
 outside_snapshot | matches 
------------------+---------
 t                | t
(1 row)

SELECT bool_and(paradedb.xmin_is_visible(xmin, tableoid, ctid)) AS visible,
       bool_and((body === 'alpha') IS NOT DISTINCT FROM (body = 'alpha')) AS matches
FROM earlier_command;
 visible | matches 
---------+---------
 t       | t
(1 row)

-- Rolled-back updates leave combo command IDs on the original tuples.
ROLLBACK TO earlier_command_update;
SELECT bool_and(paradedb.xmin_is_visible(xmin, tableoid, ctid)) AS visible,
       bool_and((body === 'alpha') IS NOT DISTINCT FROM (body = 'alpha')) AS matches
FROM earlier_command;
 visible | matches 
---------+---------
 t       | t
(1 row)

UPDATE earlier_command SET body = 'alpha' WHERE id = 2;
RELEASE SAVEPOINT earlier_command_update;
SELECT bool_and(paradedb.xmin_is_visible(xmin, tableoid, ctid)) AS visible,
       bool_and((body === 'alpha') IS NOT DISTINCT FROM (body = 'alpha')) AS matches
FROM earlier_command;
 visible | matches 
---------+---------
 t       | t
(1 row)

DECLARE earlier_command_cursor CURSOR FOR
SELECT id, paradedb.xmin_is_visible(xmin, tableoid, ctid) AS visible,
       (body === 'alpha') IS NOT DISTINCT FROM (body = 'alpha') AS matches
FROM earlier_command ORDER BY id;
SAVEPOINT earlier_command_fetch;
FETCH 1 FROM earlier_command_cursor;
 id | visible | matches 
----+---------+---------
  1 | t       | t
(1 row)

ROLLBACK TO earlier_command_fetch;
FETCH ALL FROM earlier_command_cursor;
 id | visible | matches 
----+---------+---------
  2 | t       | t
  3 | t       | t
(2 rows)

CLOSE earlier_command_cursor;
ROLLBACK;
DROP TABLE earlier_command;
CREATE TABLE returning_old_new (id int PRIMARY KEY, body text NOT NULL, covered boolean NOT NULL);
INSERT INTO returning_old_new
SELECT id, CASE WHEN id % 2 = 1 THEN 'alpha' ELSE 'beta' END, id IN (3, 4, 7, 8)
FROM generate_series(1, 8) AS id;
CREATE INDEX returning_old_new_idx ON returning_old_new USING paradedb (id, body) WHERE covered;
DO $$
DECLARE
    matches boolean;
BEGIN
    IF current_setting('server_version_num')::int >= 180000 THEN
        WITH updated AS (
            UPDATE returning_old_new
            SET body = CASE body WHEN 'alpha' THEN 'beta' ELSE 'alpha' END, covered = id > 4
            RETURNING old.body = 'alpha' AS native_old, old.body === 'alpha' AS paradedb_old,
                      new.body = 'alpha' AS native_new, new.body === 'alpha' AS paradedb_new
        )
        SELECT count(*) = 8 AND bool_and(
            native_old IS NOT DISTINCT FROM paradedb_old
            AND native_new IS NOT DISTINCT FROM paradedb_new
        ) INTO matches FROM updated;
        ASSERT matches, 'RETURNING OLD/NEW must match before and after changing index coverage';
    END IF;
END;
$$;
DROP TABLE returning_old_new;
