SET client_min_messages = error;
SET max_parallel_workers_per_gather = 0;
SET paradedb.enable_custom_scan = off;
SET enable_indexscan = off;
SET enable_indexonlyscan = off;
SET enable_bitmapscan = off;
CREATE TABLE returning_current (id int PRIMARY KEY, body text NOT NULL, note text)
WITH (fillfactor = 50);
INSERT INTO returning_current VALUES (1, 'alpha', 'before');
CREATE INDEX returning_current_idx ON returning_current USING paradedb (id, body);
BEGIN;
UPDATE returning_current SET note = 'after' WHERE id = 1
RETURNING id, body = 'alpha' AS native, body === 'alpha' AS paradedb;
 id | native | paradedb 
----+--------+----------
  1 | t      | t
(1 row)

ROLLBACK;
BEGIN;
INSERT INTO returning_current VALUES (2, 'alpha', 'new')
RETURNING id, body = 'alpha' AS native, body === 'alpha' AS paradedb;
 id | native | paradedb 
----+--------+----------
  2 | t      | t
(1 row)

ROLLBACK;
BEGIN;
SAVEPOINT returning_subxid;
UPDATE returning_current SET body = 'beta' WHERE id = 1
RETURNING id, body = 'alpha' AS native, body === 'alpha' AS paradedb;
 id | native | paradedb 
----+--------+----------
  1 | f      | f
(1 row)

INSERT INTO returning_current VALUES (2, 'alpha', 'new'), (3, 'beta', 'new')
RETURNING id, body = 'alpha' AS native, body === 'alpha' AS paradedb;
 id | native | paradedb 
----+--------+----------
  2 | t      | t
  3 | f      | f
(2 rows)

RELEASE SAVEPOINT returning_subxid;
UPDATE returning_current SET body = 'alpha'
WHERE id = 1 AND body === 'beta'
RETURNING id, body = 'alpha' AS native, body === 'alpha' AS paradedb;
 id | native | paradedb 
----+--------+----------
  1 | t      | t
(1 row)

SELECT id, body = 'alpha' AS native, body === 'alpha' AS paradedb
FROM returning_current ORDER BY id;
 id | native | paradedb 
----+--------+----------
  1 | t      | t
  2 | t      | t
  3 | f      | f
(3 rows)

DELETE FROM returning_current WHERE id = 2 AND body === 'alpha'
RETURNING id, body = 'alpha' AS native, body === 'alpha' AS paradedb;
 id | native | paradedb 
----+--------+----------
  2 | t      | t
(1 row)

ROLLBACK;
DROP TABLE returning_current;
